id,comment,pub
YS,"책읽는시간 다시 해주세요
ASMR로 딱인데",문학동네
bong G,영상보다가 바로 주문했어요. 벌써 기대되네요. 가끔이라도 이런 영상 한번씩 올려주시면 안될까요?,문학동네
문학동네창간호,문구를 보면 참지못하는.. ㅎㅋㅎㅋ,문학동네
BONA BAK,저도 10여년전에 샀지만 색연필 길이가 거의 그대로인 세트가 있어요 다들 원래 색연필 쓰려고 사는게 아니라 보려고 사잖아요?ㅎㅎㅎㅎㅎㅎㅎ,문학동네
나무기린,저도 얼른 여행을 떠나고 싶네요.,문학동네
Golden Bug,"이번 책 예약해서 얼마 전에 잘 받았습니다.
읽지 않고 있다가 다음 여행할 때 갖고 가서 읽으려고 해요.


팟캐스트는 언제 새 에피소드를 올려주실 건지 궁금합니다.",문학동네
전지영,5:00,문학동네
아름다운 4월다이아몬드 Diamond,아 김영하님 책 넘 잼나게 봤는데,문학동네
바다,'재밌어요'라는 말이 너무 좋아요. 꼭 보면 누군가의 취미를 분석하려하고 흠잡으려는 사람들이 있어서 흥이 떨어지는 경우가 많은데 그럴때마다 구차하게 대응할 필요없는것같아요. 내가 재밌어서 한다는데 왜. 김영하 작가님이 그냥 재밌어서 책으로 정리한다는 말씀이 너무 좋아요.,문학동네
박선미,"읽었어요! 넘좋았어요
추구의플롯인상깊었어요~~
메모하면서 읽게되더라구요~^^",문학동네
tirami SOOK,앗 영수증 얼마 전에 다 버려버렸네,문학동네
시시한 남자 [詩詩한 남자] 문학채널,잘 보고 갑니다.,문학동네
Michelle HJ Park,ㅋㅋㅋ 이 비디오의 정체는 asmr 이었던걸로. 작가님 유튜브 공식 채널 만들어 주세요.,문학동네
연이다,작가님 브이로그 기다리겠습니다!!,문학동네
권세나TV_30대엄마약대생활&책&도전라이프,"김영하작가님 팟캐스트도 아이팟시절부터 열심히 들었었는데 이제는 유튜브에서 만나뵙네요.
얼마 전 본 테드강연 be an artist로부터도 엄청 영감을 받았어요.
자전거전국일주, 국내일주, 아프리카 2년 등 다양한 여행을 했어요. 얼마 전에는 말레이시아 한달살기도 다녀왔어요. 작가님처럼 글쓰고 여행하는 삶을 소망합니다. 늘 영감주셔서 감사합니다. 책 주문해서 얼른 읽어볼게요^^",문학동네
남영,"여행가면 특별한 연주.. 등만 녹음했었는데 이 영상 보고 작년에 밴쿠버 여행 중 공원에서 마차를 탔을 때  말발굽 소리, 물소리, 새소리..등을 녹음해두었어요. 지금도 들으며 추억합니다. 
사진 뿐 아니라 추억하는 참 좋은 방법이예요...",문학동네
jen yun,드뎌 오셨어요 구독 좋아요 환영합니다,문학동네
J.CLOSET제리의 옷장,"김영하작가님의 책을 읽으면 항상 제 옆에서 얘기하시는 느낌이 들어서 좋아요. 
오늘은 진짜 얘기하시는군요. ㅎㅎ
좋습니당~",문학동네
Mia Mamma,김영하 정도면 유투브각 나오는데,문학동네
Yello Mello,작가님 책 너무 잘 읽었습니다~ 읽고 나서 이걸 보니 또 새롭네요~ 여행 가셔서 기록 하는 습관이 정말 좋은 것 같아요 정말 저도 따라하고 싶게 되네요 ㅎㅎ 이제 ASMR 까지 섭렵하시는 건가요 ㅎㅎㅎㅎ,문학동네
(주) 아트숨비기획팀,"2020 책마루 인문학 강연 대망의 첫 번째 강연!
『인문학적 성장을 위한 8개의 질문』, 『아이를 위한 하루 한 줄 인문학』 등을 집필한 
인문교육 전문가 김종원 작가가 전하는 ‘최선의 나를 위한 8가지 질문’!
6월 18일, 우리 모두 집에서 같이 인문학 강연 들어요!
https://youtu.be/AvNIuDJo3cs",문학동네
하윤정 [옥바라지],책속에서 영하중공여행이라는 단어가 가장 기억에 남아요ㅋㅋ,문학동네
강대나무,목소리 좋아요,문학동네
신윤주,"김영하작가님 책은 다 사서 읽었어요 
내용이 다양하면서도 다 빠져들게 만드는 것들이에요 
목소리도 차분하고 너무 좋아요 
마치 자연의 소리처럼 힐링이 되는 느낌!",문학동네
꽃따지,"아주 긴 시간동안 여행을 하고 온 것 같아요. 덕분에 글을 쓸 용기를 내어봅니다.
너무 감사합니다.~^^~",문학동네
gh g,"항상 멋지시네요. 처음 팬이 되었던 16년 전부터 지금까지 늘이요. 똥손이지만 저도 이제 여행 다녀오면 그림 좀 그려볼까봐요. 그리고, 팟캐스트는 잊지 말아주세요",문학동네
tarl Ca,김영하 작가님 존경합니다,문학동네
Fondary CHO,"괴테나 헤세도 그렇게 그림도 그리고 노트하는 여행습관이 있었던데...작가님들은 역시 기록을 잘하시네요. 저는 깜박깜박해서 노트를 가지고 다녀도, 십년노트가 되려는지, 펼치는 것도 잊어버리는데. 저도 습관을 가지려고 노력해야겠어요.  책도 다시 읽어주세요.",문학동네
je ti,멋지십니다. 여행과 가족에 대한 기록이 뜻깊네요.,문학동네
정유나,작가님 유튜브 목빼고 기다리고 있는 1인~~,문학동네
Yl y,14:59,문학동네
Sophie Kim,"오히려 책에는 일러스트가 들어가고, 노트에는 일러스트가 없어서 직접 그릴 수 있게 하면 좋겠어요. 작가님 그리시는거 보니까 저도 제 여행일러스트를 그리고 싶어서요.",문학동네
박개인,태블릿 어디꺼예요?,문학동네
LEE JH,"나도 내가 다녀온 여행에 대해서 쓰고싶다가 너무 마음에 남네요. 저번주에 오사카에 다녀왔는데 생전 처음 가본 일본이었지만
마음속 여운은 남는데 워낙에 사진을 담아두지 않는 성격이라..",문학동네
Lany,작가님 여행의자유 잘읽었어요. 팟캐스트도 꼭 다시 해주세요 잠들고싶어요♡,문학동네
박지연,"선생님 이번 책은 좀 ㅎ
읽다가 그만 ㅜ
저의 짧디 짧은 부족함이 빚은 중도포기",문학동네
TITIKI Lee,"여행의 목적은 저마다 다르지만, 여행의 기록, 소리, 후기등에 대한 좋은 팁스 감사합니다. 보다 체계적 여행으로 남길수 잇네요",문학동네
쏭's.,제가 책만 계속 읽고 리뷰는 안쓰는데...작가님 책은 제가 읽고 뭐에 홀린듯 리뷰까지 sns에 올렸어요.작가님  대단하신분 같아요.,문학동네
예원춤너울,"그동안 난 많은여행을 헛했구나...생각이 듭니다..ㅎ
작가님 존경스럽습니다.",문학동네
Ray Han,이거 보니 작가님 책읽는 시간 팟캐스트가 더더더 그리워요~~ 지금 몇번째 반복하고 있는지 모르겠어요.. 잊지 말고 가~~~끔이라도 짧은 거라도 ㅠ.ㅠ 올려주세요~기다릴께요 ^^,문학동네
Yenny G. Vivir sin fronteras,저도 노트랑 펜 사는거 넘 좋아해요. 해외동포는 전자책 나오기만을 기다립니다....,문학동네
성성윤,"작가님, 나 잠좀 자게 책읽는 시간 다시해주세요.",문학동네
Milena Lee,"아, 브라질을 다녀가셨군요~
이 곳 책방에서 쌤 책을 보았어요
뵈었다면 더 많은 스토리를 만들수있었을텐데요~",문학동네
후훗,여행가서 김영하 작가를 만나고싶습니다 언젠가 김영하를 만나지않을까  가까운미래에♡,문학동네
야다,"영하작가님의첫문장노트...
미리알지못해..
받을기회없어서ㅠ..
작가님팬 되었어요
감사합니다.늘응원합니다^^",문학동네
최우정,개인유튜버채널 만드셔야하는데.. ㅈ,문학동네
yh TV,불꽃놀이 뭔가 우주의 탄생같다,문학동네
June Kim,"안녕하세요

저도 초등학생때 "" 김찬삼의 새계여행"" 을  많이 본적이 있어요..  주위에 아는 사람을 본적이 없었는데.. 잠시 추억여행을 한기분이에요.. 감사합니다,",문학동네
Lastman K,목소리가 참 매력적이에요,문학동네
Seon,영상을 처음부터 끝까지 보기가 참 쉽지 않았는데 끝나는 게 아쉬운 영상이네요. 제가 걷기 운동할 때 작가님 팟캐스트를 듣는데 점차 줄어들어서 아쉬워요. 책 재밌게 보겠습니다.,문학동네
hk lee,김영하작가님 왜죠? 왜 세월이 흐를수록 더 잘생겨지시죠?,문학동네
코스모스,글도잘쓰시고 그림도 잘그리시고 목소리도 편안하시고..여행을 어떻게 해야 하는지를 안내해주시는것같아 좋습니다.  여행보다는 우루루 몰려다니는관광을 하쟎아요.🥰,문학동네
Jenny kyungeuny,"[랄랄라 하우스] 김영하, 리뷰

https://m.blog.naver.com/illiter/222064131074",문학동네
helena cho,"안녕하세요. 뉴질랜드 타향살이 6년차 작가님 팬 입니다. 잠이 오지 않는 밤, 작가님 팟캐스트를 듣다 혹시나해서 오클랜드 도서관에 검색을 해 봤습니다. 작가님 책의 여러 번역본들과 심지어 한국어 책들도 있더군요. 반가운 마음에 급히 예약 해 두었습니다. 작가님께도 반가운 소식일지도 몰라 글 남깁니다. 책 읽는 시간 팟캐스트를 네번째 정주행중입니다. 업로드 조심스럽게 부탁드려요!  감사합니다.",문학동네
인간승리,"작가님 👍🏼😻 이런 작가님 개인의 경험이나 소소하게 이야기하는 걸 많이 보거나 듣고 싶네요. 목소리도 , 말하는 방식이나 톤이나 깔끔한 구성까지 너무 좋아요.👍🏼😻✨💓진짜 유튜브 하면 조용조용하니 너무 좋을듯.. 💘",문학동네
Single Air,와와!! 신간 내셨군요,문학동네
정만효,작가님 책 읽어 주는것이  저의 수면제 얐는데 ...목소리 좋으세요.~,문학동네
고양,검은꽃,문학동네
Belle Won,여행의 이유 책을 어제 샀는데 기대하며 먼저 영상을 보게 되었네요~ 어떻게 이책을 쓰신걸까 김영하님의 여행에 대한 이야기를 들을 수 있어 좋을 것 같아요. 지금은 코로나로 여행이 너무 어려워졌는데 여행을 가고 싶어 이책을 보게 되었네요. 어머니의 가계부속 여행의 기록도 재밌네요^^ 영상 즐겁게 보고 갑니다. 감사합니다.,문학동네
김연서,김영하의 책 읽는 시간 팟캐스트 전 회차를 100씩은 들은거 같아요. 항상 기다리고 있습니다.,문학동네
솔향기,반갑습니다,문학동네
uytp hyr,"책 읽는 시간 해 주셔요
김영하 작가님이  읽어 주는
ㅡ 누구를 대체 불가
ㅡ 너무 그립습니다
ㅡ김영하 작가님  유튜브나
팟 캐스트 해 주셔요
ㅡ목소리  ㆍ 말하는  톤ㅡ 내용
너무 조아요",문학동네
산청월든,https://blog.naver.com/1001cho/221508263456   부족하지면 제 개인 블로그에도 열심히 홍보중입니다 ㅋㅋㅋ 만나는 사람마다 이야기 하고 있구요 ^^ 저를 독서의 세계로 안내해주신분이  김영하 선생님입니다. (팟캐스트를 통해 알게 되었죠^^) 좋은 유투브 동영상 만들어주신 문학동네에도 너무 너무 감사드려요 ^^,문학동네
myungsun ko,작가님 영감을 주시네요. 젊을때는 여행이 소중한 시간이라 기록에 공을 들였지만 조금 나이가 들고 나서는 조금 귀찮아져서 기록을 하지 않았는데 작가님의 여행기록법이 너무 좋고 즐거워 보여 다음달 여행에서는 저도 노트한권 만들어보려 해요~ 감사합니다~,문학동네
채희연,최애작가님~이런방가방가~유투브하시다니^^,문학동네
조성은,말씀하시는 톤이며 알찬 구성과 이 편안한 분위기가 정말 좋습니다! 이 영상 보고 바로 문학동네 구독하고 가요 ㅠㅠ,문학동네
sama guu,고양이들은 잘 있으신가요? 저랑 비슷한 시기에 같은 회색 알마캣 캣타워 쓰고 있어서 기억에 남네요. 저희 애들은 벌써 12살...여유로운 냥님들이 되었지요.,문학동네
카푸치노,책장 넘기는 소리 너무 좋네요 ㅎㅎ asmr 하시는 김에 작가님께서 쓰신 글 낭독하는 시간은 없나요?ㅎㅎ,문학동네
김홍희 채널,김영하 선생님 안녕하세요? 저는 선생님이 팟캐스트에서 소개 했던 [방랑]의 저자 김홍희 입니다. 저도 보름 전 유튜브를 시작 했습니다. 선생님 항상 감사 합니다. 언제 한 번 뵐 수 있기를 바랍니다. 항상 건강하시고 건투를 빕니다. ^^,문학동네
이정숙,"2019년 4월 24일 목요일 우와 소설가 김영하 씨인데요, 팟캣스트 이후로는, 텔레비전 종편에 <알쓸신잡>  이후로는 처음이네요!!! 90년대 후반 대학 디닐 때 노희경 은희경 그리고 김영하가... 아 아우튼 너무 반가운데요... 지금 나와 시 낭독 녹음놀이하는 어느 분의 유튜브 수신함에서 가장 반가운 영상이 바로 이것이네요. 고마워요 ^^ ♡",문학동네
Crystal Son,"저도 제 인생에 처음이자 마지막 일수도 있을 한달 여행을 떠나는데요...
이주 정도 남았는데
영상을 보면서 아~ 나도 기록을 해봐야겠다 라는 생각이 들었어요
혼자 가는거기도 하고...
예전엔 사진만 찍었었는데
제시해주신 것처럼 좀 더 다양한 방법으로 남겨봐야지 싶어요 ^^
목소리가 차분하고 넘 좋으세요
듣고 있으니 제 마음도 편안해지는 것 같네요",문학동네
Jiyoung Lee,"전 소설을 진짜 어려워 하는 사람인데 맨 처음 읽은 소설이 '살인자의 기억법'이였어요 ㅎㅎㅎ길었으면 안 읽었을거에욧..네이버 블로그https://blog.naver.com/clarify 후기 한번 봐주세요 ㅎㅎㅎ 저는 철학책들 위주로만 읽고 고리타분한 책들만 주로 좋아했는데..소설이 너무 어렵고 이해가 안가고..그러다 궁금해서 처음으로 읽은 게 김영하 소설가님 책이고 소설가들 누가 있는지 이름만 아는 정도에요...두 번째로 읽은건 채식주의자 그렇게 2개만 끝까지 읽었어요. ㅎㅎㅎ ㅠㅠㅠㅠㅠㅠ소설하고 만화책은 너무 어려워요..읽고 싶어도 못읽는...책읽는 시간인가 그거 여러개 들어봤답니다. 그나마 책보다는 오디오로 듣는게 저한테는 소설은 잘 맞는 것 같아서요. 소설을 철학책만큼 좋아하고 싶은데 철학은 재밌는데 소설은 왜 재미가 없고 어려운지 어떻게 하면 소설도 재밌게 읽을 수 있는지좀 알려주세요~~~~~블로그에 끄적거리기에 소설 못 읽는다고 다 적어놨어요.잘 읽고 싶어요. 베스트셀러가 대부분 소설들인데 읽지를 못해서...답답하네요(아참, 그리고 위대한 겟츠비 책 번역한 사람이 김영하님으로 나오는데 그 책 읽었는데 살인자의 기억법 쓰신 분과 같은 분이에요??)유튜브로 김영하님이 오디오북처럼 읽어주세요. 그렇게 듣는게 더 잘 들어와요.귀에도 마음속에도요. 소설을 좋아할 수 있게 해주세요 ㅠㅠ",문학동네
스코룸_scroom,"여행을 가게 되면 전 사진도 많이 찍게 되더라고요 ㅎㅎ 그 장소 , 시간에 따라 그림도 그려보고 싶지만 전 패키지 여행을 즐기다 보니 나중에 그려보려고 사진을 보면서 그리게 되더라고요. 작가님 처럼 사진만 찍지 말고 소리 녹음 해놓은 것도 좋다는 걸 세삼 느껴 보네요... ㅎㅎ 저도 5년(6년전?)전 부터 아무리 스마트폰 보다 종이의 느낌이 좋아서 또다시 그림이랑 다이어리 꾸미는걸 즐기게 되더라고요 ㅎㅎ 작가님 처럼 글을 쓰는 것도 더욱 더 즐기게 되면 더 깔끔하게 다이어리에 바로바로 기록해 주겠죠? ㅎㅎ 기록의 의미 참 좋은 것 같아요 .( 요즘은 종이에다가 많이 그리기도 하고 , 아이패드에 어쩌다가 그리기도 하고 주로 종이를 많이 사용을 해요 ㅎㅎ;;)",문학동네
SeoEun Kim,"안녕하세요. 궁금한 것이 있어 댓글을 남겨봅니다. 
일상을 기록할 노트를 준비하는 것으로 여행을 시작한다면, 그것은 하루를 기록하는 일기와 무엇이 다른가요. 설레임? 새로운 환경?
그저 저는... 여행과 무관한 어느 삶이던지 모험과 같다는 생각을 합니다. 매일이 지루하지만 어찌 보면 새로운 것이 특히 한국의 삶인 것 같습니다. 
그렇다면 이 여정의 기록은 어떤 것을 남겨두어야 좋을까요... 인상적인 풍경의 그림을 그리는 것은 좋은 방법인 듯 합니다. 다만, 그것을 글로 옮길 때 어떤 감정을 가지는 게 좋을까요.
작가님은 어떤 감정을 글로 보통 옮기시는가요?",문학동네
휘뚜루마뚜루,앗 저도 여행가서 찍은 사진을 그림으로 그리는 걸 즐기곤 해요. 실력은 비루하지만^^;;; 2007년부터 작가님이 내놓은 산물들을 접하며 지내다보니 감성이 닮아가나 봐요ㅎㅎㅎ,문학동네
후훗,그림을 증말 증응말 자아알  ㅋ,문학동네
김만호,지식인이 한마디 하셔야지요 작금의 사태에 대해서 ...,문학동네
조용팔,"애는~~
남의 책은 수만권 읽은거같은데
정작
지 책은 너무 시시하다,
오직 한사람 인가
오직 두사람 인가
읽고 확인해보길,ㅋㅋㅋ",문학동네
안i'm,"선생님
그럼 그런 아이를 키우면서 상처입고 마음아픈 엄마의 마음은 누가 달래주나요?
엄마도 부모도 사람인데 달래주고 사과도 하고
뭐든 다 했는데도 바뀌지 않아요
그런 아이를 보는 엄마의 마음은 누가 달래주나요?
너무 마음이 아픕니다",창비
최보금,"이걸 왜 내가 듣고 있는거야.
우리 엄마가 들어야 될 것을.",창비
오재봉,"중1병
중2병
중3병
고1병. 아직도 고2병 고3병.남았는데  무섭고 두렵다. 아들아😭.",창비
난다강,"저도 2년 걸렸어요.
ㅠㅠ
아이가 이제서야 제마음을 알고
매일 와서  안기며 웃어줘요
아이는 엄마가 바뀌면 분명 달라져요
영상 보고 위로 받고 갑니다",창비
정지현,아이를 향한 통찰.. 책 표지의 엄마처럼 깊은 생각이 필요한 것 같아요. 아이의 사춘기는 부모의 성장기이기도 하네요^^,창비
자녀교육최경선,"잔소리는 멈추고 편안하게 해주고  엄마의 진정어린 사과, 아이가 바라는 방향으로 함께 조정해보는 것 참 좋은 팁이네요~ 영상 감사히 보고 갑니다.",창비
이미숙,"참 듣는 사람이 편안하게 
정말 잘하시네요
김미경쇼에서 보고
깜짝 놀랐어요 
진작 알았더라면
아들 둘이 더 잘 자랐을거 같은데 욕심이~~",창비
기운전달!!,"다가가는 방법을 다르게 써보는 건
중요한 뽀인트 같습니다
아이마다 다르더라구요
ᆢ원하는 게 뭐냐고 물어봐 주면 될거
같아요ᆢ

큰딸 초5때 엄마가 처음이라 서툴다
미안하다
그랬더니
쏘쿨 첫째ᆢ
나도 딸이 처음이라~~
미투 ㅎㅎㅋㅋㅋ

요즘 애덜 당해낼 재간이 읍다
걍ᆢ무조건 물어봅니다
해줄 수 있는건 도와주고ᆢ
아니면ᆢ 냉정하게 노우~~
사춘기는 얼마든지 시행착오 할수있는 시간이고
엄마는 멀리서 지켜봐야하는 시기이죠
때론 냉정하리만큼이요

그래도 시행착오 시간을 줄이고 싶다면ᆢ
그저 물어봅니다",창비
MinJi Kim,"부모의 노력, 사실 노력을 해야한다는 걸 알지만 쉽게 되지 않는 것 같아요! 
그렇기에 매일매일 부단히 마음을 다잡고 행동으로 실천해야 하는 것..! 
너무너무 궁금한 책입니다!",창비
늘행운,우리딸도 고1 드가는데 초6부터 시작해서 지금까지 넘 힘듭니다 ㅜㅜ 조금 나아진거는 같지만 아직도 넘 힘드네요,창비
댄댄댄쓰,감사합니다! 유읻한 이야기 마음이 와닿는 귀한 이야기 고맙습니다. ^^,창비
댕댕이듀오,"또 배우고 갑니다 감사합니다
알면서도 행동하지못할때 아차  싶습니다
사과하며 더  노력하고싶습니다",창비
개미스토리,엄마와아이는같이큰다 김미경강사좋은말,창비
박수영,아이가 속상해할때 같이 공감해주고 기뻐할때 엄마가 더 기뻐해주고 칭찬해주고 좌절할때 위로하고 용기를 주는것이 우리 부모의 어른들의 몫이라고 싱각됩니다~아이들은 자신들을 이해해준다고 생각될때 마음을 여는것 같아요~너무나 차분하고 공감가는 말씀 감사드립니다 ~^^,창비
해밀,"제가 어렸을 때 마음과 다르게      말은 거칠고 행동은 공격적이었어요.  그때는 내가 왜 이러는지? 어느 누가 내 마음을 알아주고 다독거려 주었으면 좋겠다고 생각했어요 그런 제가 자식을 낳고는 키우면서 고비가 있었어요 그래서 책으로 공부도 하고 부모 교육을 받고    많이 느꼈어요. 그러면서 나의 어릴때  모습도 그려지고 내가 아이한테 잘 못했던것도 생각이 나면서 반성을 많이 했어요 지금 저희 아이들도 10대이긴 한데 오히려 그 어릴때보다 덜 힘들고 관계가 좋아진거 같아요 느낀건 내가 자랄 때 받았던 부모의 양육 방식이 좋지 않으면 그 방법으로내 아이를 키우면 안 
된다는 거에요 부모가 깨우치고 노력하는 마음이 중요하다는 생각을 지금 영상보며 느끼고 배우고 갑니다",창비
박지숙,"돌아오면
잔소리 멈추고 돌아와 줘서 고맙다
엄마의 사과
3~4학년이 넘어가면 교과 과목이 어러워짐
엄마가 어떻게 도와 줄까?

고맙습니다~^^",창비
안쥬와친구들,저희 부모님이 사과를 잘안하셨어요 그게 항상 맘속에 응어리였던지 .. 저는 사과를 너무 잘하는 사람이 되었습니다ㅋㅋㅋㅋㅋㅋㅋ 지금 딸한테도 좀만 잘못하면 사과봇이됩니다 그랬더니 딸도 사과봇ㅋㅋㅋㅋㅋㅋㅋㅋㅋㅋ 오히려 다행인거네요 ㅎㅎ,창비
Agent 찐찐's,저도 큰애가 중2인데  어떻게 대할지 몰라서 난감해요..잘 보고갑니다.,창비
Sue Lee,"내 아이를 키우는데 이런저런 방법 들어도 그때뿐리예요.. 작심 3주.. 
부모님 자신이 바뀌어야죠. 
아이가 그렇게 반응하면 그건 분명 엄마아빠한테 문제가 있는거죠.. 
그리고 아빠의 역할이 정말 중요해요.. 
행복한 집에서는 아이가 잘못될수없죠.. 
그리고 진심으로 내 아이를 위하는게 뭔지 고민해야 하고요..",창비
Eunice Hi,"페미스트는 아니지만 엄마랑 아빠, 부모님 나아가서 자주 접하는 일가친척들도 함께 같이 존중해야 할 것 같아요.",창비
이금숙 올리브67,저도 큰아들 대1때 진심으로 사과하고 우울증과 대인기피증 이었던 아들이 조금씩 변하고 있어요,창비
Moony,명령말고 대화를 하면 됌.,창비
별을품다TV,"저도 김미경   tv에서 알게 되었어요.
첫째아이와 오늘 갈등이 있었는데, 영상보고 적용해보려구요. 책도 읽어볼께요. 감사합니다.",창비
김경희,"저~엉말 아이의 중2병에 힘들었던 1인입니다.저도 잔소리도 하고 나무라기도 하고 울기도 많이 울었습니다.그러나 단한지! 놓칠 수 없었던 건 '아들'이었습니다.아들도 아프다고 몸부림치고 있었던 것이니까요...그 모습이 더 아팠습니다.제가 할 수 있는 건 '기다림'뿐이었습니다.어느 날 아이에게 팔찌를 하나 선물했습니다. 'I believe in tou'이라고 각인을 한...거짓말처럼 딱! 1년뒤 돌아왔습니다.원래의 모습으로 돌아와서 아이가 말했습니다.흔들릴 때마다 팔찌를 봤다고... 팔찌는 본인에게 수호신과 같다고...울먹이며 고맙다고 말하는 나를 아이가 안아 주며 말합니다.""괜찮다. 이제 안그럴께""",창비
공부나해라,엄마가 볼껄 왜 내가 보고있는거여,창비
Hyun-min Kum,"진짜 중2병은 학원도 안다니고 공부도 아예 안해요... 가끔 티비에서 아이 때문에 스트레스 받는 부모들이 나와서 하소연하는데 제 동생에 비하면 선비에요. 적어도 제 동생처럼 학교는 툭하면 빠지고 부모한테 대들고 성적은 개판이고 몰래 담배 피우고.. 이런 아이들을 대상으로 상담도 하시고 변화된 모습을 보여줄 수 없나요? 
뭔가 도움이 될 만한 내용일까 기대를 했는데 좀 허무하네요.. 저 아이의 행동은 대학생들도 하는  행동이에요..",창비
jung hwang,늘 아이 어렸을 때를 생각하며 훈육  방법에 대해 후회하지만 현재가 또 다른 과거가 될 수 있는데 잘못을 반복하고 있는 제 자신이 너무 원망스럽습니다 정말 어찌하면 아이를 바르게 끼울 수 있을까요?,창비
히도,제발 아빠랑엄마가 봤으면 엄마는 그렇다치고 아빠라도 제발....,창비
뚱이사랑,"저는 중2병, 사춘기를 표현 할 수 있는 환경이 아니였어요. 제 방도 없었고 혼자서 삭힐  수 밖에 없었어요. 아무도 몰라주고 표현도 못 했던 시절 생각에 눈물이 나네요..
이런 내가 아들의 사춘기를 난 잘 받아 줄 수 있을까요?",창비
초보고기장사진홍,"당신은 상담사라서 그렇게 말하겠지만 썩어들어가는 부모는 모두 상담사가 아니다.
시간 흘러가다보면 돌아온다는 말은 참 허무하게 들린다.",창비
