id,comment,pub
MA A,"그냥 약한 아이 인거 같은대....
간단히 말해서 멘탈이 약한거고 케어를 어떻게 해주냐에 따라서 달라지는 거네요",창비
ᄋᄋ,사과하면뭐해 행동이 안바뀌는데,창비
바람따라,"어이구 그런게 중2병이면 업고 다니겟네요
저희집은 학교도 안가고 방에서 꼼짝을 안해요
시간이란 계념이 없어요
밥먹는 시간도 따로없고 거기다 편식에 무슨
말만하면 욕하고 소리지르고 인터넷으로 물건
싸질러 폭탄요금 나오게 만들고 자기방은 들어오지도 못하게하고 엉망이고..안좋은건 종합세트로 하고잇으니깐요. 집나고 싶은사람은 딱
접니다",창비
마음가는대로,학원 숙제 힘들어하는 아이한테 딴애들 다 하는데 왜 그러냐 ㅜㅜ 제가 그랬네요ㅠㅠ,창비
박경아,"공부하면서 짜증내길래
그러면 좀 쉬었다하라고 했는데
그말조차 (내 목소리조차) 듣기싫어하더라구요
걍 내버려두래요
주먹으로 쇼파 치고 책 찢고 욕하고 하는걸 누가 그냥 보고만 있을수 있나요?",창비
dotorooo oioi,"저자님을 통해 알게 된 시진이. 달리지고 싶은 마음을 마주하고 있으니 마음이 아릿해집니다. 시진이의 마음을 열게 해준 것이 바로 엄마의 사과라는 말에 고개를 끄덕이게 됩니다. 
흔히들 말하는 중2병. 그래서 아이가 달라져도 으레 그러려니 하고 넘어가게 되는 것 같아요. 그렇게 하면 저절로 나아지리라는 무심함으로....... 반면 그럴수록 아이의 마음을 들여다봐야 한다는 생각입니다. 이렇게 아이의 방문을 열기전에, 아이의 마음을 열기 위해 조금만, 한 템포만 늦춰 아이의 자리에 서서 생각해본다면, 아이와 맞는 대화법으로 말을 건넨다면 분명 좋은 결과가 있으리라 생각합니다. 청소년과의 특별한 5단계 대화법을 차근차근 따라함으로써 아이의 환한 웃음을 마주할 수 있기를.....",창비
TheMusicmalife,"참 이상하다. 사춘기라는 거는 누구나 겪는 거고 그것을 '변화'의 대상으로 보기 보다는 '한 때 머물다 지나가는 것'으로 보는 봐야할텐데, 그것마저도 정상성에 범주를 이탈한 변화의 대상으로 보니..안타깝다.
정신 좀 차렸으면 좋겠다. 관계에도 계절이 있음을 받아 들였으면 한다. 계절의 끝이 없듯이, 겨울은 계절의 끝이 아님을 알았으면 좋겠다.
또한, 자녀의 문제를 '사춘기'라는 범주에 넣으면서 오히려 문제를 축소시키며, 나아가 왜곡하는 우를 범하지 마시길. 문제는 밖에 있다는 것을 알았으면 좋겠다. 사춘기는 '변화의 대상'이 아니며, 겨울은 '비정상'이 아니듯이, 모든 계절은 정답이며, 모든 계절은 자신의 계절을 극복할 힘이 내재돼 있다는 것을 아셨으면 좋겠다. 또한 믿으셨으면 좋겠다. 그렇지 않다면 양육자는 끊임없이 불안해 할테고, 그 불안함을 '사춘기'라는 소위 '당신만의 비정상'에 투사시키면서 양육자와 피양육자 서로를 파괴할 것이다  그것은 사랑이 아니다. 사랑은 믿음이다. 그렇기에 힘들다.",창비
